{
  "calculationAt": "2026-09-15T18:30:00Z",
  "calculationDay": {
    "jdn": "2461300"
  },
  "observer": {
    "longitude": 45.481
  },
  "targetDay": {
    "jdn": "2461305",
    "gregorian": {
      "era": "CE",
      "year": "2026",
      "month": 9,
      "day": 20
    }
  },
  "pastafarianDate": {
    "year": "5000",
    "cutlet": {
      "canonicalIndex": 15,
      "name": "Akkad",
      "day": 351
    },
    "month": {
      "canonicalIndex": 26,
      "name": "Joy",
      "day": 22
    }
  },
  "locale": "en",
  "formatted": "Example formatted date"
}
